<?xml version="1.0" encoding="UTF-8"?>
<config xmlns="http://www.hundsun.com/ooas/config" xmlns:xsi="http://www.w3.org/2001/XMLSchema-instance"
    xsi:schemaLocation="http://www.hundsun.com/ooas/config ../config.xsd">

    <group id="risk_config" label="问卷相关配置">
        <property name="examrisk_autofill" label="风险评测是否自动填充" default="false" description="风险评测自动填充你年龄, 职业，学历题目的答案">
			<validator type="checkbox">
				<option label="是" value="true"></option>
				<option label="否" value="false"></option>
			</validator>
		</property>
		<property name="examrisk_hiddenexam" label="风险评测自动填充的题目是否隐藏" default="false" description="风险评测为自动填充才生效">
			<validator type="checkbox">
				<option label="开" value="true"></option>
				<option label="关" value="false"></option>
			</validator>
		</property>
		<property name="risk_age_options" label="年龄区间及对应选项id " default="" description="格式为[年龄区间下限,年龄区间上限]=选项号:[年龄区间下限,年龄区间上限]=选项号，例如: [0,30]=1:[31,40]=2:[41,50]=3:[51,60]=4:[61,999]=5  ， 需要与问卷题目选项一致，风险评测为自动填充才生效">
			
		</property>
		<property name="risk_job_options" label="职业区间及对应选项id " default="" description="格式为[字典子项1,字典子项2,字典子项n]=选项号:[字典子项1,字典子项2,字典子项n]=选项号，需要与问卷题目选项及数据字典1015配置一致 ，风险评测为自动填充才生效">
			
		</property>
		<property name="risk_degree_options" label="学历区间及对应选项id " default="" description="格式为[字典子项1,字典子项2,字典子项n]=选项号:[字典子项1,字典子项2,字典子项n]=选项号，需要与问卷题目选项及数据字典1014配置一致 ，风险评测为自动填充才生效">
			
		</property>
		<property name="risk_degree_trans" label="学历的选项ID对应修改的学历字典值" default="" description="格式为 选项号=字典子项:选项号=字典子项，需要与问卷题目选项及数据字典1014配置一致 ，风险评测为自动填充，并且配置了学历区间及对应选项id后，才生效">
			
		</property>
		
    </group>
</config>